{
  "$schema": "https://json-schema.org/draft/2020-12/schema",
  "$id": "https://getmaipai.github.io/shared/spec/schemas/conversation.schema.json",
  "title": "Conversation",
  "description": "One chat thread, per person and per surface (platform plan 4.14). Its turns live separately (hub-internal, conversation_turns); this record is the thread itself: title, rolling summary, and lifecycle. See session-a-intelligence.md step 3.",
  "type": "object",
  "additionalProperties": false,
  "required": ["id", "person", "surface", "status", "source", "hlc", "created_at", "updated_at"],
  "properties": {
    "id": {
      "type": "string",
      "pattern": "^conv-[a-z0-9]{6,}$"
    },
    "person": {
      "type": "string",
      "pattern": "^person-[a-z0-9]{6,}$",
      "description": "Whose conversation this is. A conversation is never shared across people."
    },
    "device_id": {
      "type": ["string", "null"],
      "pattern": "^device-[a-z0-9]{6,}$",
      "description": "The robot this conversation happened on. Null for every other surface."
    },
    "surface": {
      "type": "string",
      "enum": ["chat", "overlay", "pod", "robot", "tv", "phone"],
      "description": "Matches turnEngine.ts's Surface (4.5): a person may hold one open conversation per surface at a time."
    },
    "mode": {
      "type": "string",
      "enum": ["chat", "research", "temporary"],
      "default": "chat",
      "description": "How this conversation presents answers: chat keeps the ordinary reply; research keeps the details pane open after a short line; temporary keeps turns out of normal history and durable memory."
    },
    "companion_id": {
      "type": ["string", "null"],
      "default": null,
      "description": "The companion persona active when this conversation was created (5.4); null before companions exist as packages (step 8)."
    },
    "title": {
      "type": ["string", "null"],
      "maxLength": 200,
      "default": null,
      "description": "Household-editable; null until set (PATCH /api/conversations/:id)."
    },
    "pinned": {
      "type": "boolean",
      "default": false,
      "description": "Whether this conversation stays at the top of its person's list."
    },
    "folder_id": {
      "type": ["string", "null"],
      "pattern": "^folder-[a-z0-9]{6,}$",
      "default": null,
      "description": "The chat folder (chat-folder.schema.json, shown as a Project) this conversation sits in, or null. The folder belongs to the same person. A temporary conversation never has one; the host enforces that, since a cross-field rule here would be lost in codegen (see README on allOf/if/then) (CHAT-PROJECT-01a)."
    },
    "settings": {
      "type": "object",
      "additionalProperties": true,
      "description": "Optional settings remembered with this conversation. Unknown keys are preserved for additive cross-client evolution.",
      "properties": {
        "thinking": {
          "type": "boolean",
          "description": "Whether turns in this conversation use extended reasoning. Absent means the default (Instant)."
        },
        "model": {
          "type": "string",
          "description": "Optional model id selected for turns in this conversation. Absent means the role default."
        },
        "read_aloud": {
          "type": "boolean",
          "description": "Whether assistant replies are read aloud automatically in this conversation. Absent means off."
        }
      }
    },
    "status": {
      "type": "string",
      "enum": ["open", "closed", "deleted"],
      "description": "Open is active for this person and surface. Closed is inactive and requires an explicit resume before another turn. Deleted is terminal. Resuming closes other open conversations on that surface and clears stale pending confirmations; reading never resumes.",
      "default": "open"
    },
    "summary": {
      "type": ["string", "null"],
      "default": null,
      "description": "The rolling summary of turns that have fallen out of the prompt window (step 3's window/summary rule)."
    },
    "summary_through_turn": {
      "type": ["string", "null"],
      "default": null,
      "description": "The last conversation_turns id folded into `summary`, so the refresh job knows what's new since then."
    },
    "source": {
      "type": "string",
      "enum": ["hub", "local"],
      "description": "hub: authoritative on the hub. local: begun on a robot, not yet synced (4.14: 'a chat begun on the robot appears on the phone through the hub... robot turns sync as conversation records'). Mirrors person.schema.json's own source field."
    },
    "hlc": {
      "type": "string",
      "pattern": "^[0-9]+:[0-9]+:[a-z0-9]{6,}$",
      "description": "Hybrid logical clock: wall_ms:counter:node (7.3)."
    },
    "created_at": { "type": "string", "format": "date-time" },
    "updated_at": { "type": "string", "format": "date-time" }
  }
}
