{
  "id": "conv-g7h8i9",
  "person": "person-a1b2c3",
  "surface": "chat",
  "mode": "chat",
  "companion_id": null,
  "title": "Raised bed layout",
  "settings": {
    "thinking": true,
    "model": "chat-primary",
    "read_aloud": true,
    "future_option": "kept by older clients"
  },
  "status": "open",
  "source": "hub",
  "hlc": "1757000000000:0:a1b2c3",
  "created_at": "2026-09-05T12:00:00Z",
  "updated_at": "2026-09-05T12:05:00Z",
  "folder_id": "folder-a1b2c3"
}
